{
  "schemaVersion": 1,
  "id": "w08",
  "slug": "sunny-farmstead",
  "order": 8,
  "title": "Sunny Farmstead",
  "description": "Farm animals and harvest time",
  "theme": "farm",
  "levelCount": 50,
  "levelsPerPack": 25,
  "offlineStarter": false,
  "packIds": [
    "w08-p01",
    "w08-p02"
  ],
  "legacyLevelIds": []
}
