{
  "schemaVersion": 1,
  "id": "w14",
  "slug": "dragonlight-valley",
  "order": 14,
  "title": "Dragonlight Valley",
  "description": "Gentle dragons and crystal caves",
  "theme": "dragons",
  "levelCount": 50,
  "levelsPerPack": 25,
  "offlineStarter": false,
  "packIds": [
    "w14-p01",
    "w14-p02"
  ],
  "legacyLevelIds": []
}
