{
  "schemaVersion": 1,
  "id": "w20",
  "slug": "rainbow-carnival",
  "order": 20,
  "title": "Rainbow Carnival",
  "description": "Rides, games, and a cheerful parade",
  "theme": "carnival",
  "levelCount": 50,
  "levelsPerPack": 25,
  "offlineStarter": false,
  "packIds": [
    "w20-p01",
    "w20-p02"
  ],
  "legacyLevelIds": []
}
